state,bill_name,bill_summary,status,bill_url,lastAction_date,lastAction_main
TN,HJR0252,Margaret D. Scott,Intro,https://legiscan.com/TN/bill/HJR0252/2019,2019-03-07,Withdrawn.
TN,HJR0249,Fred Martin,Intro,https://legiscan.com/TN/bill/HJR0249/2019,2019-03-07,Withdrawn.
TN,HJR0245,Leslie Jones,Intro,https://legiscan.com/TN/bill/HJR0245/2019,2019-03-07,Withdrawn.
PA,HR136,A Resolution urging the United States Census Bureau to change its policy of recording the residence of incarcerated individuals from the location of the correctional facilities to the last known home address of the incarcerated individuals.,Intro,https://legiscan.com/PA/bill/HR136/2019,2019-03-08,To House State Government Committee
WI,SB108,Vacancies in elective offices in cities and villages.,Intro,https://legiscan.com/WI/bill/SB108/2019,2019-03-15,"To Senate Elections, Ethics and Rural Issues Committee"
WI,AB89,Vacancies in elective offices in cities and villages.,Intro,https://legiscan.com/WI/bill/AB89/2019,2019-03-21,To House Campaigns and Elections Committee
TX,HCR144,"In memory of former House Speaker Pro Tempore D. R. ""Tom"" Uher of Bay City.",Intro,https://legiscan.com/TX/bill/HCR144/2019,2019-03-28,Filed
CA,AR27,Relative to the 2020 Decennial Census.,Pass,https://legiscan.com/CA/bill/AR27/2019,2019-04-01,Read. Adopted.
MT,SJ17,Interim study of PSC composition,Intro,https://legiscan.com/MT/bill/SJ17/2019,2019-04-03,(S) Tabled in Committee (S) State Administration
FL,H0615,Repeals provisions relating to Florida Election Campaign Financing Act; deletes provisions governing public funding of campaigns for candidates for statewide office who agree to certain expenditure limits.,Intro,https://legiscan.com/FL/bill/H0615/2019,2019-04-04,Placed on Calendar
TN,HB0699,"As introduced, establishes the Tennessee Plane Coordinate System as new system of defining and stating geographic positions and locations in Tennessee. - Amends TCA Title 3, Chapter 1, Part 1; Title 4, Chapter 16 and Title 66, Chapter 6.",Enroll,https://legiscan.com/TN/bill/HB0699/2019,2019-04-16,Transmitted to Governor for his action.
NC,H820,"Honor Arlie Culp, Former Member of the GA",Intro,https://legiscan.com/NC/bill/H820/2019,2019-04-16,Filed
MD,HB67,Establishing the Potomac Compact for Fair Representation; providing that a compacting state is not required to comply with the Compact under certain circumstances; establishing the Congressional Districting Commission to develop a congressional distr...,Intro,https://legiscan.com/MD/bill/HB67/2019,2019-03-14,Unfavorable Report by House Rules and Executive Nominations
MS,SB2909,An Act To Provide That The Secretary Of State Shall Promulgate Rules And Regulations For The Verification By The Registrar Of A Person's Eligibility To Be An Elector; To Provide That Those Rules And Regulations Shall Also Prescribe The Procedure For ...,Fail,https://legiscan.com/MS/bill/SB2909/2019,2019-02-05,Died In Committee
MN,SF1185,Election of state legislators without political party designation establishment; election public subsidy program modification,Intro,https://legiscan.com/MN/bill/SF1185/2019,2019-02-14,To Senate State Government Finance and Policy and Elections Committee
TX,HCR31,Urging Congress to restore and strengthen the Voting Rights Act of 1965.,Intro,https://legiscan.com/TX/bill/HCR31/2019,2019-02-25,To House Elections Committee
KY,HR1,Adopt Rules of Procedure for the 2019 Regular Session of the House of Representatives.,Pass,https://legiscan.com/KY/bill/HR1/2019,2019-01-08,adopted by voice vote
US,SB561,Voting Rights Advancement Act of 2019,Intro,https://legiscan.com/US/bill/SB561/2019,2019-02-26,To Senate Judiciary Committee
KY,HB174,"Create new sections of KRS Chapter 67 to establish a new procedure for the optional consolidation of counties; exclude consolidated local governments, charter county governments, urban-county governments, and unified local governments from the proced...",Intro,https://legiscan.com/KY/bill/HB174/2019,2019-02-06,To House Local Government Committee
NJ,S1934,"Provides that salary and other costs associated with Commissioner of Education's appointment of State monitor and other staff under ""School District Fiscal Accountability Act"" will be paid by State.",Intro,https://legiscan.com/NJ/bill/S1934/2018,2018-02-22,To Senate Education Committee
MS,SB2855,An Act To Restore The Right Of Suffrage To Certain Persons Disqualified By Reason Of Conviction Of A Disenfranchising Crime; To Provide That A Person Shall Be Enfranchised After Completing Any Sentence And Paying Any Fines Imposed By The Sentencing C...,Fail,https://legiscan.com/MS/bill/SB2855/2019,2019-02-05,Died In Committee
MS,HB1346,An Act To Require A Voting Precinct To Be Located On The Campus Of Each Public Or Private Four-year Postsecondary Institution Of Higher Learning; To Provide That Such Voting Precinct Shall Be Used By Students Who Are Duly Enrolled In A Program Of Stu...,Fail,https://legiscan.com/MS/bill/HB1346/2019,2019-02-05,Died In Committee
MN,HF597,"Single-house legislature provided, legislature of 99 members provided by statute, and constitutional amendment proposed.",Intro,https://legiscan.com/MN/bill/HF597/2019,2019-01-31,To House Government Operations Committee
MN,SF757,Constitutional amendment providing for a single-house legislature,Intro,https://legiscan.com/MN/bill/SF757/2019,2019-01-31,To Senate State Government Finance and Policy and Elections Committee
MS,HB488,"An Act To Amend Section 37-7-203, Mississippi Code Of 1972, To Provide For The Election Of Members Of The Boards Of Education In A Municipality Having A Mayor-council Form Of Government At The Same Time As The General Municipal Election And To Establ...",Fail,https://legiscan.com/MS/bill/HB488/2019,2019-02-05,Died In Committee
NE,LB467,Prohibit consideration of certain factors in redistricting,Intro,https://legiscan.com/NE/bill/LB467/2019,2019-02-06,To Legislature Executive Board Committee
MO,HJR47,Modifies provisions for redistricting and lobbyist gifts,Intro,https://legiscan.com/MO/bill/HJR47/2019,2019-04-16,HCS Reported Do Pass (H)
TN,SB0561,"As introduced, extends the deadline for the advisory task force reviewing the composition of Tennessee's current judicial districts to publish its proposed statewide judicial redistricting plan from December 1, 2019, to December 15, 2019. - Amends TC...",Intro,https://legiscan.com/TN/bill/SB0561/2019,2019-04-17,To Senate Judiciary Committee
TN,HB1156,"As introduced, extends the deadline for the advisory task force reviewing the composition of Tennessee's current judicial districts to publish its proposed statewide judicial redistricting plan from December 1, 2019, to December 15, 2019. - Amends TC...",Intro,https://legiscan.com/TN/bill/HB1156/2019,2019-04-17,"To House Finance, Ways & Means Subcommittee Committee"
MS,SB2572,An Act To Provide That The Governor May Restore The Right Of Suffrage To Certain Persons Disqualified By Reason Of Conviction Of A Disenfranchising Crime; To Provide That A Person Shall Be Enfranchised After Completing Any Sentence And Paying Any Fin...,Fail,https://legiscan.com/MS/bill/SB2572/2019,2019-02-05,Died In Committee
IA,SCR5,A concurrent resolution relating to joint rules of the Senate and House of Representatives for the Eighty-eighth General Assembly.,Intro,https://legiscan.com/IA/bill/SCR5/2019,2019-03-07,Message from House. S.J. 495.
IA,HCR11,A concurrent resolution relating to joint rules of the Senate and House of Representatives for the Eighty-eighth General Assembly. (Formerly HSB 98.),Intro,https://legiscan.com/IA/bill/HCR11/2019,2019-03-07,Withdrawn. H.J. 465.
IA,HSB98,A concurrent resolution relating to joint rules of the Senate and House of Representatives for the Eighty-eighth General Assembly.,N/A,https://legiscan.com/IA/bill/HSB98/2019,2019-03-05,"Committee report, recommending passage. H.J. 403."
MS,SB2464,"An Act To Provide That Any Person Submitting A Voter Registration Application Must Present Certain Documents To Prove His Or Her Status As A United States Citizen; To Amend Sections 23-15-33, 23-15-39 And 23-15-47, Mississippi Code Of 1972, To Confor...",Fail,https://legiscan.com/MS/bill/SB2464/2019,2019-02-05,Died In Committee
HI,HB927,"Authorizes the Land Use Commission to amend, revise, or modify a decision and order granting a district boundary amendment, or fine a petitioner, upon finding that a petitioner or its successors or assigns have not adhered to the conditions imposed b...",Intro,https://legiscan.com/HI/bill/HB927/2019,2019-01-28,"To House Water, Land, & Hawaiian Affairs Committee"
IL,HB2631,"Amends the Election Code. Removes ward committeepersons for each ward in cities containing a population of 500,000 or more and township committeepersons for each township or part of a township that lies outside of cities having a population of 200,00...",Intro,https://legiscan.com/IL/bill/HB2631/2019,2019-03-29,To House Rules Committee
MS,SB2073,"An Act To Abolish Partisan Primaries; To Provide The Time For Holding General And Preferential Elections; To Provide That When Only One Person Has Qualified As A Candidate For An Office, Such Person's Name Shall Be Placed On The General Election Ball...",Fail,https://legiscan.com/MS/bill/SB2073/2019,2019-02-05,Died In Committee
MS,SB2085,"An Act To Abolish Partisan Primaries; To Provide The Time For Holding General And Preferential Elections; To Provide That When Only One Person Has Qualified As A Candidate For An Office, Such Person's Name Shall Be Placed On The General Election Ball...",Fail,https://legiscan.com/MS/bill/SB2085/2019,2019-02-05,Died In Committee
IA,HF216,A bill for an act concerning county supervisor representation plans.,Intro,https://legiscan.com/IA/bill/HF216/2019,2019-03-05,To House Local Government Committee
IL,HB0827,"Amends the Election Code. Provides for the election of the board of trustees of the City Colleges of Chicago, Illinois Community College District No. 508, at the general primary election in 2020 on a nonpartisan ballot. Provides that a member of the ...",Intro,https://legiscan.com/IL/bill/HB0827/2019,2019-03-29,To House Rules Committee
IL,SB1859,"Amends the Election Code. Provides for the election of the board of trustees of the City Colleges of Chicago, Illinois Community College District No. 508, at the general primary election in 2020 on a nonpartisan ballot. Provides that a member of the ...",Intro,https://legiscan.com/IL/bill/SB1859/2019,2019-02-15,To Senate Assignments Committee
IL,SB0206,"Amends the Election Code. Provides for the election of the board of trustees of the City Colleges of Chicago, Illinois Community College District No. 508, at the general primary election in 2020 on a nonpartisan ballot. Provides that a member of the ...",Intro,https://legiscan.com/IL/bill/SB0206/2019,2019-02-05,To Senate Assignments Committee
IA,SSB1124,A bill for an act concerning county supervisor representation plans.,N/A,https://legiscan.com/IA/bill/SSB1124/2019,2019-02-06,"Subcommittee: Garrett, Lofgren and Quirmbach."
IL,SB1600,Creates the 2020 Census Grant Program Act. Creates the 2020 Census Grant Program for the purpose of issuing matching grants to local governments and nonprofit organizations to support the accurate counting of the population of the State and its local...,Intro,https://legiscan.com/IL/bill/SB1600/2019,2019-03-28,To Senate Assignments Committee
IL,HB0928,Creates the 2020 Census Grant Program Act. Creates the 2020 Census Grant Program for the purpose of issuing matching grants to local governments and nonprofit organizations to support the accurate counting of the population of the State and its local...,Intro,https://legiscan.com/IL/bill/HB0928/2019,2019-03-29,To House Rules Committee
AK,HB39,Approp: Operating Budget/loans/funds,Engross,https://legiscan.com/AK/bill/HB39/2019,2019-04-12,To Senate Finance Committee
MS,SB2102,"An Act To Amend Section 37-7-203, Mississippi Code Of 1972, To Provide That The Trustees Of Municipal Separate School Districts Shall Be Elected From Special Trustee Election Districts By The Qualified Electors Of Such District Beginning With The Mun...",Fail,https://legiscan.com/MS/bill/SB2102/2019,2019-02-05,Died In Committee
HI,HB1209,"Requires the Commission to file annual reports on the status of the progress of five-year boundary review. Requires counties to file annual updates to general plans, development plans, or community plans. (HB1209 HD2)",Engross,https://legiscan.com/HI/bill/HB1209/2019,2019-03-18,To Senate Housing Committee
US,HB1799,Voting Rights Amendment Act of 2019,Intro,https://legiscan.com/US/bill/HB1799/2019,2019-03-14,To House Judiciary Committee
NJ,ACR60,Proposes constitutional amendment to change legislative Apportionment Commission membership; establishes new requirements on commission for process and legislative district composition.,Intro,https://legiscan.com/NJ/bill/ACR60/2018,2018-01-09,To Assembly State and Local Government Committee
AK,SB19,Approp: Capital Budget; Supplemental,Intro,https://legiscan.com/AK/bill/SB19/2019,2019-02-13,To Senate Finance Committee
AK,HB38,Approp: Capital Budget,Intro,https://legiscan.com/AK/bill/HB38/2019,2019-02-21,To House Finance Committee
GA,SR4,A RESOLUTION adopting the Rules of the Senate; and for other purposes.,Engross,https://legiscan.com/GA/bill/SR4/2019,2019-01-14,Senate Passed/Adopted
MS,SB2068,"An Act To Codify Section 37-6-17, Mississippi Code Of 1972, To Enact The ""nonpartisan School Board Election Act""; To Provide That Beginning With The November 2023 General Election And The November 2024 Presidential Election, The Members Of The County...",Fail,https://legiscan.com/MS/bill/SB2068/2019,2019-02-05,Died In Committee
NJ,ACR119,Proposes constitutional amendment to change legislative Apportionment Commission membership; establishes new requirements on commission for process and legislative district composition.,Intro,https://legiscan.com/NJ/bill/ACR119/2018,2018-02-01,To Assembly State and Local Government Committee
IL,SB0153,Amends the Election Code. Provides for the election of the Chicago Board of Education starting with the 2023 consolidated primary election. Makes related changes. Amends the Chicago School District Article of the School Code. Provides that a person s...,Intro,https://legiscan.com/IL/bill/SB0153/2019,2019-02-26,Added as Chief Co-Sponsor Sen. Martin A. Sandoval
IL,HB0042,Amends the Election Code. Provides for the election of the Chicago Board of Education starting with the 2023 consolidated primary election. Makes related changes. Amends the Chicago School District Article of the School Code. Provides that a person s...,Intro,https://legiscan.com/IL/bill/HB0042/2019,2019-03-29,To House Rules Committee
MS,HB999,An Act To Create The Pre-election Day Voting Act; To Provide Definitions; To Provide That The Pre-election Day Voting Period Shall Begin Twenty-one Days Before The Election And Continue Until Noon On The Saturday Immediately Preceding The Election; T...,Fail,https://legiscan.com/MS/bill/HB999/2019,2019-02-05,Died In Committee
IL,SB1587,Amends the Election Code. Provides for the election of the Chicago Board of Education at the general primary election in 2020 only as a nonpartisan election on a separate ballot. Provides that a member of the Chicago Board of Education shall be elect...,Intro,https://legiscan.com/IL/bill/SB1587/2019,2019-04-05,To Senate Assignments Committee
MS,SB2508,An Act To Restore The Right Of Suffrage To Certain Persons Disqualified By Reason Of Conviction Of A Disenfranchising Crime; To Provide That Such Persons Shall Be Enfranchised After Completing The Term Of Incarceration And Parole Or Upon The Impositi...,Fail,https://legiscan.com/MS/bill/SB2508/2019,2019-02-05,Died In Committee
ID,H0171,ELECTIONS -- Amends existing law to revise the time lines for the transmission of certain election and ballot information and to make other election law changes.,Pass,https://legiscan.com/ID/bill/H0171/2019,2019-03-18,"Reported Signed by Governor on March 18, 2019 Session Law Chapter 96 Effective: 03/18/2019"
IN,SB0560,Various election law matters. Makes the following changes: (1) Removes provisions relating to candidates for President of the United States filing ballot placement requests with the secretary of state. (2) Provides that the election division annual t...,Enroll,https://legiscan.com/IN/bill/SB0560/2019,2019-04-17,Motion to dissent filed
VA,HB2450,"Annexation; alternatives. Makes the current temporary moratorium on city annexation permanent by removing the expiration date and references to city annexation throughout the Code. Similarly, provisions regarding county immunity to city annexation ar...",Intro,https://legiscan.com/VA/bill/HB2450/2019,2019-02-05,"To House Counties, Cities and Towns Committee"
MN,HF1554,"Public subsidy program repealed, and voluntary pledges to abide by expenditure limited provided.",Intro,https://legiscan.com/MN/bill/HF1554/2019,2019-02-21,To House Government Operations Committee
MS,HB1338,"An Act To Amend Section 23-15-11, Mississippi Code Of 1972, To Provide That A Person Who Is Otherwise A Qualified Elector And Has Been Convicted Of A Felony Shall Have His Or Her Right To Vote Suspended Upon Conviction And Shall Not Have His Or Her R...",Fail,https://legiscan.com/MS/bill/HB1338/2019,2019-02-05,Died In Committee
MS,HB1526,"An Act To Amend Section 23-15-11, Mississippi Code Of 1972, To Provide That A Person Who Is Otherwise A Qualified Elector And Has Been Convicted Of A Felony Shall Have His Or Her Right To Vote Suspended Upon Conviction And Shall Not Have His Or Her R...",Fail,https://legiscan.com/MS/bill/HB1526/2019,2019-02-05,Died In Committee
NJ,SCR152,Proposes constitutional amendment to change legislative Apportionment Commission membership; establishes new requirements on commission for process and legislative district composition.,Intro,https://legiscan.com/NJ/bill/SCR152/2018,2018-12-13,Public Hearing Held SSG
MS,HB1189,"An Act To Amend Section 23-15-11, Mississippi Code Of 1972, To Provide That A Person Who Is Otherwise A Qualified Elector And Has Been Convicted Of Bribery, Theft, Arson, Obtaining Money Or Goods Under False Pretense, Perjury, Forgery, Embezzlement O...",Fail,https://legiscan.com/MS/bill/HB1189/2019,2019-02-05,Died In Committee
MS,HB476,"An Act To Amend Section 23-15-11, Mississippi Code Of 1972, To Provide That A Person Who Is Otherwise A Qualified Elector And Has Been Convicted Of A Felony Shall Have His Or Her Right To Vote Suspended Upon Conviction And Shall Not Have His Or Her R...",Fail,https://legiscan.com/MS/bill/HB476/2019,2019-02-05,Died In Committee
MS,HB985,"An Act To Amend Section 23-15-11, Mississippi Code Of 1972, To Provide That A Person Who Is Otherwise A Qualified Elector And Has Been Convicted Of A Felony Shall Have His Or Her Right To Vote Suspended Upon Conviction And Shall Not Have His Or Her R...",Fail,https://legiscan.com/MS/bill/HB985/2019,2019-02-05,Died In Committee
MS,HB955,"An Act To Amend Section 23-15-11, Mississippi Code Of 1972, To Provide That A Person Who Is Otherwise A Qualified Elector And Has Been Convicted Of Vote Fraud Or Of Any Crime Listed In Section 241, Mississippi Constitution Of 1890, Shall Have His Or ...",Fail,https://legiscan.com/MS/bill/HB955/2019,2019-02-05,Died In Committee
MS,HB1420,"An Act To Amend Section 23-15-11, Mississippi Code Of 1972, To Provide That A Person Who Is Otherwise A Qualified Elector And Has Been Convicted Of Vote Fraud Or Of Any Crime Listed In Section 241, Mississippi Constitution Of 1890, Shall Have His Or ...",Fail,https://legiscan.com/MS/bill/HB1420/2019,2019-02-05,Died In Committee
NJ,ACR205,Proposes constitutional amendment to change legislative Apportionment Commission membership; establishes new requirements on commission for process and legislative district composition.,Intro,https://legiscan.com/NJ/bill/ACR205/2018,2018-12-13,Public Hearing Held AJU
HI,SB741,"Requires boundary amendments reflected in certain plans to be adopted in accordance with the approved plans, upon approval by the county land use decision-making authority, with concurrence from the land use commission. Increases housing inventory by...",Intro,https://legiscan.com/HI/bill/SB741/2019,2019-01-24,To Senate Housing Committee
MS,HB1027,"An Act To Amend Section 23-15-11, Mississippi Code Of 1972, To Provide That A Person Who Is Otherwise A Qualified Elector And Has Been Convicted Of Vote Fraud Or Of Any Crime Listed In Section 241, Mississippi Constitution Of 1890, Shall Have His Or ...",Fail,https://legiscan.com/MS/bill/HB1027/2019,2019-02-05,Died In Committee
CT,HB07160,To implement the Governor's budget recommendations.,Intro,https://legiscan.com/CT/bill/HB07160/2019,2019-04-12,Referred to Office of Legislative Research and Office of Fiscal Analysis 04/17/19 5:00 PM
AK,SB20,Approp: Operating Budget/loans/funds,Intro,https://legiscan.com/AK/bill/SB20/2019,2019-02-13,To Senate Finance Committee
CT,HB07148,To implement the Governor's budget recommendations.,Intro,https://legiscan.com/CT/bill/HB07148/2019,2019-02-22,To Joint Appropriations Committee
NE,LB246,Change provisions relating to elections,Intro,https://legiscan.com/NE/bill/LB246/2019,2019-03-05,Placed on General File
NM,HB407,Election Laws 50-year Tune-up,Pass,https://legiscan.com/NM/bill/HB407/2019,2019-03-12,Signed by Governor - Chapter 212 - Apr. 3
MS,HB998,An Act To Create The Early Voting Act; To Provide Definitions; To Provide That The Early Voting Period Shall Begin Thirty Days Before The Election And Continue Until The Last Regular Business Day Preceding The Election; To Provide That Early Voting S...,Fail,https://legiscan.com/MS/bill/HB998/2019,2019-02-05,Died In Committee
MS,HB1389,An Act To Create The Early Voting Act; To Provide Definitions; To Provide That The Early Voting Period Shall Begin Six Days Before The Election And Continue Until The Last Regular Business Day Preceding The Election; To Provide That Early Voting Shal...,Fail,https://legiscan.com/MS/bill/HB1389/2019,2019-02-05,Died In Committee
MS,HB1000,An Act To Create The Early Voting Act; To Provide Definitions; To Provide That The Early Voting Period Shall Begin Fifteen Days Before The Election And Continue Until The Last Regular Business Day Preceding The Election; To Provide That Early Voting ...,Fail,https://legiscan.com/MS/bill/HB1000/2019,2019-02-05,Died In Committee
MS,HB861,An Act To Create The Pre-election Day Voting Act; To Provide Definitions; To Provide That The Pre-election Day Voting Period Shall Begin Twenty Days Before The Election And Continue Until Noon On The Saturday Immediately Preceding The Election; To Pr...,Fail,https://legiscan.com/MS/bill/HB861/2019,2019-02-05,Died In Committee
MS,HB1001,An Act To Create The Pre-election Day Voting Act; To Provide Definitions; To Provide That The Pre-election Day Voting Period Shall Begin Twenty-one Days Before The Election And Continue Until Noon On The Saturday Immediately Preceding The Election; T...,Fail,https://legiscan.com/MS/bill/HB1001/2019,2019-02-05,Died In Committee
IL,SB1146,"Amends the Election Code. Provides that, except for in a county with a population of at least 3,000,000 or where election judges are selected by election commissioners, an election authority may reduce the number of judges of election in each precinc...",Intro,https://legiscan.com/IL/bill/SB1146/2019,2019-03-28,To Senate Assignments Committee
IL,HB2245,"Amends the Election Code. Provides that, except in a county with a county board of election commissioners, an election authority may reduce the number of judges of election in each precinct from 5 to 3 for any election. Provides that in certain citie...",Intro,https://legiscan.com/IL/bill/HB2245/2019,2019-03-29,To House Rules Committee
WA,SB5784,Concerning records disclosure and retention obligations of the legislative branch.,Intro,https://legiscan.com/WA/bill/SB5784/2019,2019-02-13,"To Senate State Government, Tribal Relations & Elections Committee"
ID,HJR002,"REDISTRICTING -- Proposes an amendment to Section 2, Article III, of the Idaho Constitution to increase the membership of the Commission for Reapportionment.",Intro,https://legiscan.com/ID/bill/HJR002/2019,2019-02-12,U.C. to be returned to State Affairs Committee
MS,SB2827,"An Act To Amend Section 9-1-43, Mississippi Code Of 1972, To Increase The Limit On Compensation Of Chancery Clerks And Circuit Clerks; To Amend Section 23-15-225, Mississippi Code Of 1972, To Increase The Compensation Of County Registrars Of Election...",Enroll,https://legiscan.com/MS/bill/SB2827/2019,2019-04-02,Due From Governor 04/19/19
AR,SB463,"To Amend The Law Concerning Initiatives And Referenda; And To Provide For The Licensing, Registration, And Enforcement Of Laws Concerning Certain Persons And Entities That Participate In The Paid Canvassing Industry.",Engross,https://legiscan.com/AR/bill/SB463/2019,2019-04-10,Recommended for study in the Interim Committee on STATE AGENCIES & GOVT'L AFFAIRS-SENATE
UT,HB0164,Local Boards and Councils Structure Amendments,Intro,https://legiscan.com/UT/bill/HB0164/2019,2019-03-14,House/ filed in House file for bills not passed
FL,S0556,"Requiring that a universal primary election open to all qualified electors, regardless of political party affiliation or lack thereof, be held for purposes of selecting candidates for specified federal, state, local, and district offices; specifying ...",Intro,https://legiscan.com/FL/bill/S0556/2019,2019-03-05,To Senate Ethics and Elections Committee
NC,S1,2019 Senate Permanent Rules,Pass,https://legiscan.com/NC/bill/S1/2019,2019-01-09,Adopted
NE,LB193,"Change provisions relating to cities of particular classes and villages, correct and include references as prescribed, and eliminate obsolete provisions and repeal definitions",Pass,https://legiscan.com/NE/bill/LB193/2019,2019-03-12,"Approved by Governor on March 07, 2019"
