state,bill_name,bill_summary,status,bill_url,lastAction_date,lastAction_main
TN,SB0230,"As introduced, requires the senate judiciary committee and the house civil justice committee to conduct at least one joint, public hearing on the judicial redistricting plan proposed by the advisory task force to review composition of judicial distri...",Intro,https://legiscan.com/TN/bill/SB0230/2019,2019-02-05,Withdrawn.
NE,LB578,Provide for venue of legal proceedings challenging laws regarding redistricting,Intro,https://legiscan.com/NE/bill/LB578/2019,2019-02-11,To Legislature Judiciary Committee
FL,S1458,"Deleting a public records exemption relating to redistricting plans, etc.",Intro,https://legiscan.com/FL/bill/S1458/2019,2019-03-05,To Senate Ethics and Elections Committee
TX,HB4500,Relating to cancellation of all voter registrations following decennial redistricting.,Intro,https://legiscan.com/TX/bill/HB4500/2019,2019-03-26,To House Elections Committee
WA,SB5502,Aligning statutory redistricting deadlines to the Constitution.,Engross,https://legiscan.com/WA/bill/SB5502/2019,2019-04-16,"Third reading, passed; yeas, 96; nays, 0; absent, 0; excused, 2."
IL,HJRCA0003,"Proposes to amend the Legislature Article of the Illinois Constitution. Provides that no person may serve more than eight years in the General Assembly. Provides that no person may be elected or appointed as Senator or Representative if, upon complet...",Intro,https://legiscan.com/IL/bill/HJRCA0003/2019,2019-01-10,To House Rules Committee
CA,ACA2,State tax agency.,Intro,https://legiscan.com/CA/bill/ACA2/2019,2018-12-04,From printer. May be heard in committee January 3.
MO,SJR23,Modifies provisions regulating the legislature to limit the influence of partisan or other special interests,Intro,https://legiscan.com/MO/bill/SJR23/2019,2019-03-14,"To Senate Rules, Joint Rules, Resolutions & Ethics Committee"
WV,HB2990,The purpose of this bill is to create 34 single senatorial districts based on the 2010 census and implemented during the 2020 elections,Intro,https://legiscan.com/WV/bill/HB2990/2019,2019-02-11,To House Judiciary Committee
IL,HB3814,"Appropriates $17,129,100 from the General Revenue Fund to the State Board of Elections for operational expenses, grants, reimbursements, and the Census 2020 Redistricting Program for the fiscal year ending June 30, 2020. Appropriates various amounts ...",Intro,https://legiscan.com/IL/bill/HB3814/2019,2019-03-19,To House Rules Committee
IL,SB2243,"Appropriates $17,129,100 from the General Revenue Fund to the State Board of Elections for operational expenses, grants, reimbursements, and the Census 2020 Redistricting Program for the fiscal year ending June 30, 2020. Appropriates various amounts ...",Intro,https://legiscan.com/IL/bill/SB2243/2019,2019-03-19,To Senate Assignments Committee
OR,HB2492,"Directs Department of Corrections to determine last-known address of inmates in custody of department, if address is readily known or available to inmate, and submit information to Secretary of State. Directs secretary to adjust population data repor...",Intro,https://legiscan.com/OR/bill/HB2492/2019,2019-04-17,To House Rules Committee
MO,HJR41,Modifies provisions for the number of House of Representative and Senate districts,Intro,https://legiscan.com/MO/bill/HJR41/2019,2019-03-27,Reported Do Pass (H) - AYES: 7 NOES: 1 PRESENT: 0
CT,SB00874,To implement the Governor's budget recommendations.,Intro,https://legiscan.com/CT/bill/SB00874/2019,2019-04-04,To Joint Appropriations Committee
MD,HB528,"Requiring the Police Commissioner of Baltimore City, following each decennial census of the United States, to prepare a plan for the adjustment of the geographic boundaries and composition of each Baltimore City police district and the reallocation o...",Enroll,https://legiscan.com/MD/bill/HB528/2019,2019-04-03,Returned Passed
NJ,SCR33,Proposes constitutional amendments to establish redistricting standards for Apportionment Commission; requires Chief Justice of Supreme Court to select 11th member from pool of general public applicants; requires commission to hold public hearings.,Intro,https://legiscan.com/NJ/bill/SCR33/2018,2018-01-09,"To Senate State Government, Wagering, Tourism & Historic Preservation Committee"
VA,HJR1014,Commending the League of Women Voters of Arlington.,Pass,https://legiscan.com/VA/bill/HJR1014/2019,2019-02-21,Bill text as passed House and Senate (HJ1014ER)
CA,SR27,Relative to the 2020 Decennial Census.,Pass,https://legiscan.com/CA/bill/SR27/2019,2019-04-04,Read. Adopted. (Ayes 37. Noes 0.)
MN,SF1183,Campaign finance regulation for elected Metropolitan Council members establishment; vacancy filling process establishment; election of two at-large members authorization; staggered terms for appointed members establishment,Intro,https://legiscan.com/MN/bill/SF1183/2019,2019-02-14,To Senate State Government Finance and Policy and Elections Committee
TN,SB0997,"As introduced, establishes the Tennessee Plane Coordinate System as new system of defining and stating geographic positions and locations in Tennessee. - Amends TCA Title 3, Chapter 1, Part 1; Title 4, Chapter 16 and Title 66, Chapter 6.",Intro,https://legiscan.com/TN/bill/SB0997/2019,2019-04-08,Companion House Bill substituted
MS,SR19,A Resolution To Commend And Recognize District 31 State Senator And Former Senate President Pro Tempore Terry C. Burton For His Distinguished Service In The Mississippi Senate.,Engross,https://legiscan.com/MS/bill/SR19/2019,2019-03-27,Immediate Release
OK,HB2338,Elections; districts of county commissioners; modifying filing period dates for declarations of candidacy; modifying date of issuance of certificate of election; emergency.,Intro,https://legiscan.com/OK/bill/HB2338/2019,2019-02-12,Emergency added
MD,SB39,"Requiring the Police Commissioner of Baltimore City, following each decennial census of the United States, to prepare a plan for the adjustment of the geographic boundaries and composition of each Baltimore City police district and the reallocation o...",Enroll,https://legiscan.com/MD/bill/SB39/2019,2019-04-02,Returned Passed
MO,HJR57,Modifies provisions relating to redistricting and lobbying,Intro,https://legiscan.com/MO/bill/HJR57/2019,2019-04-03,To House General Laws Committee
MS,SB2302,"An Act To Amend Section 9-7-15, Mississippi Code Of 1972, To Update Precincts And Precinct Names In The Fourth Circuit Court District To Conform To The 2010 Census Data; To Bring Forward Section 9-7-17, Mississippi Code Of 1972, For Clarity; To Provi...",Fail,https://legiscan.com/MS/bill/SB2302/2019,2019-02-05,Died In Committee
NJ,AJR111,Calls on Congress to permit incarcerated individuals to use home address as address of record for federal decennial census.,Intro,https://legiscan.com/NJ/bill/AJR111/2018,2018-04-05,To Assembly State and Local Government Committee
IL,HR0227,"Declares April 1, 2019 as ""Census Day in Illinois"". Encourages every citizen in the State to support efforts to insure an accurate census in 2020.",Intro,https://legiscan.com/IL/bill/HR0227/2019,2019-04-09,To House Rules Committee
WA,HB1956,Modifying the election and authority of regional transit authority board members.,Intro,https://legiscan.com/WA/bill/HB1956/2019,2019-02-07,To House Transportation Committee
WA,SB5220,Modifying the election and authority of regional transit authority board members.,Intro,https://legiscan.com/WA/bill/SB5220/2019,2019-02-26,To Senate Transportation Committee
UT,SB0165,Quorum Requirements,Pass,https://legiscan.com/UT/bill/SB0165/2019,2019-03-19,Senate/ to Governor in Executive Branch - Governor
NY,A00274,Requires the state board of elections to develop a program to be administered by all boards of elections to notify voters of certain information where their area has been redistricted.,Intro,https://legiscan.com/NY/bill/A00274/2019,2019-01-09,To Assembly Election Law Committee
NE,LB261,Require use of redistricting maps drawn using state-issued computer software,Intro,https://legiscan.com/NE/bill/LB261/2019,2019-02-06,To Legislature Executive Board Committee
WA,HB1494,Aligning statutory redistricting deadlines to the Constitution.,Intro,https://legiscan.com/WA/bill/HB1494/2019,2019-03-21,To House Rules Committee
SD,HB1136,Repeal provisions regarding legislative districts.,Intro,https://legiscan.com/SD/bill/HB1136/2019,2019-02-20,"State Affairs Tabled, Passed, YEAS 7, NAYS 4. H.J. 458"
MN,SF47,Metropolitan council gubernatorial appointees local approval requirement; local governments removal of council member procedures authorization ,Intro,https://legiscan.com/MN/bill/SF47/2019,2019-03-14,Second reading
IL,HB0045,"Amends the Election Code. Provides that a person must be 17 years of age or older (currently, 18 years of age or older) to circulate petitions for nomination.",Intro,https://legiscan.com/IL/bill/HB0045/2019,2019-03-29,To House Rules Committee
GA,SR67,"A RESOLUTION recognizing Senator William ""Bill"" S. Jackson and dedicating an interchange in his honor; and for other purposes.",Enroll,https://legiscan.com/GA/bill/SR67/2019,2019-04-09,Senate Sent to Governor
MO,HJR48,"Proposes constitutional amendments relating to lobbying, redistricting, and the sunshine law",Intro,https://legiscan.com/MO/bill/HJR48/2019,2019-04-17,Reported Do Pass (H) - AYES: 6 NOES: 2 PRESENT: 0
CA,AB1829,Elections.,Intro,https://legiscan.com/CA/bill/AB1829/2019,2019-04-01,To Assembly Elections and Redistricting Committee
MO,SJR29,Modifies provisions regulating the legislature to limit the influence of partisan or other special interests,Intro,https://legiscan.com/MO/bill/SJR29/2019,2019-03-14,"To Senate Rules, Joint Rules, Resolutions & Ethics Committee"
IL,HB3114,Amends the Election Code. Requires the State Board of Elections to create a pilot program to allow petition signatures to be gathered electronically. Provides that a statement of candidacy shall include a space for a candidate to include his or her t...,Intro,https://legiscan.com/IL/bill/HB3114/2019,2019-03-29,To House Rules Committee
IL,SB2083,Amends the Election Code. Requires the State Board of Elections to create a pilot program to allow petition signatures to be gathered electronically. Provides that a statement of candidacy shall include a space for a candidate to include his or her t...,Intro,https://legiscan.com/IL/bill/SB2083/2019,2019-03-28,To Senate Assignments Committee
MS,HR133,"A Resolution Commending The Distinguished And Laudable Legislative Career Of Former Representative, The Honorable Adrienne Wooten And Congratulating Her Upon Being Elected To The Bench As Circuit Court Judge Of District 7, Place 1, Hinds County, Miss...",Pass,https://legiscan.com/MS/bill/HR133/2019,2019-03-25,Enrolled Bill Signed
MD,HB1409,Altering the amount of the school facilities surcharge in Howard County for certain types of residential construction; authorizing the County Council of Howard County to enact a local law providing for the annual alteration of the amount of the schoo...,Enroll,https://legiscan.com/MD/bill/HB1409/2019,2019-04-08,Returned Passed
VA,SB323,Virginia Independent Redistricting Review Commission; split precincts. Establishes the seven-member Virginia Independent Redistricting Review Commission for the purpose of reviewing redistricting plans adopted by the General Assembly to ensure that p...,Intro,https://legiscan.com/VA/bill/SB323/2019,2018-11-30,To Senate Privileges and Elections Committee
VA,HJR642,Constitutional amendment (first resolution); Virginia Redistricting Commission; shortest split methodology. Establishes the seven-member Virginia Redistricting Commission to redraw congressional and General Assembly district boundaries after each dec...,Intro,https://legiscan.com/VA/bill/HJR642/2019,2019-02-05,To House Privileges and Elections Committee
TX,HJR57,Proposing a constitutional amendment to set the salaries of members of the legislature and the lieutenant governor based on the average public school teacher salary in this state.,Intro,https://legiscan.com/TX/bill/HJR57/2019,2019-02-25,To House State Affairs Committee
NM,SB509,Regional Water Utility Authority Act,Intro,https://legiscan.com/NM/bill/SB509/2019,2019-02-08,Action Postponed Indefinitely
US,HB4,Voting Rights Advancement Act of 2019,Intro,https://legiscan.com/US/bill/HB4/2019,2019-03-25,"To House Subcommittee on the Constitution, Civil Rights, and Civil Justice Committee"
WA,HB1091,Making technical corrections and removing obsolete language from the Revised Code of Washington pursuant to RCW 1.08.025.,Enroll,https://legiscan.com/WA/bill/HB1091/2019,2019-04-16,Delivered to Governor.
MS,HB927,"An Act To Amend Section 23-15-49, Mississippi Code Of 1972, To Authorize Online Voter Registration For First-time Voters; To Amend Sections 23-15-13, 23-15-35, 23-15-37, 23-15-39, 23-15-41 And 23-15-79, Mississippi Code Of 1972, To Conform To The Pro...",Fail,https://legiscan.com/MS/bill/HB927/2019,2019-02-05,Died In Committee
MS,HB690,"An Act To Amend Section 23-15-49, Mississippi Code Of 1972, To Authorize Online Voter Registration For First-time Voters; To Amend Sections 23-15-13, 23-15-35, 23-15-37, 23-15-39, 23-15-41 And 23-15-79, Mississippi Code Of 1972, To Conform To The Pro...",Fail,https://legiscan.com/MS/bill/HB690/2019,2019-02-05,Died In Committee
MS,HB1028,"An Act To Amend Section 23-15-49, Mississippi Code Of 1972, To Authorize Online Voter Registration For First-time Voters; To Amend Sections 23-15-13, 23-15-35, 23-15-37, 23-15-39, 23-15-41 And 23-15-79, Mississippi Code Of 1972, To Conform To The Pro...",Fail,https://legiscan.com/MS/bill/HB1028/2019,2019-02-05,Died In Committee
MS,HB1348,"An Act To Amend Section 23-15-49, Mississippi Code Of 1972, To Authorize Online Voter Registration For First-time Voters; To Amend Sections 23-15-13, 23-15-35, 23-15-37, 23-15-39, 23-15-41 And 23-15-79, Mississippi Code Of 1972, To Conform To The Pro...",Fail,https://legiscan.com/MS/bill/HB1348/2019,2019-02-05,Died In Committee
MS,SB2917,"An Act To Amend Section 23-15-49, Mississippi Code Of 1972, To Authorize Online Voter Registration For First-time Voters; To Amend Sections 23-15-13, 23-15-35, 23-15-37, 23-15-39, 23-15-41 And 23-15-79, Mississippi Code Of 1972, To Conform To The Pro...",Fail,https://legiscan.com/MS/bill/SB2917/2019,2019-02-05,Died In Committee
CT,HB07192,To implement the Governor's budget recommendations.,Intro,https://legiscan.com/CT/bill/HB07192/2019,2019-04-17,File Number 688
MO,SJR13,Modifies provisions relating to members of the General Assembly,Intro,https://legiscan.com/MO/bill/SJR13/2019,2019-04-18,"Informal Calendar S Bills for Perfection--SJR 13-Holsman, with SCS, SS for SCS & SA 1 (pending)"
VA,SB1284,"County and city precincts; required to be wholly contained within election districts; waiver for administration of split precinct. Requires each county and city precinct to be wholly contained within a single congressional district, Senate district, ...",Intro,https://legiscan.com/VA/bill/SB1284/2019,2019-01-15,Incorporated by Privileges and Elections
KY,HB455,Amend KRS 5.005 to remove exclusive jurisdiction for legislative redistricting from Franklin Circuit.,Intro,https://legiscan.com/KY/bill/HB455/2019,2019-02-21,To House Judiciary Committee
TX,HR924,In memory of former state representative Paul Cruz Moreno.,Pass,https://legiscan.com/TX/bill/HR924/2019,2019-04-05,Reported enrolled
TX,HR201,"Recognizing February 26, 2019, as Texas NAACP Day at the State Capitol.",Pass,https://legiscan.com/TX/bill/HR201/2019,2019-02-27,Reported enrolled
MS,HB1003,"An Act To Abolish Partisan Primaries; To Provide The Time For Holding General And Preferential Elections; To Provide That When Only One Person Has Qualified As A Candidate For An Office, Such Person's Name Shall Be Placed On The General Election Ball...",Fail,https://legiscan.com/MS/bill/HB1003/2019,2019-02-05,Died In Committee
MS,HB1002,"An Act To Abolish Partisan Primaries; To Provide The Time For Holding General And Preferential Elections; To Provide That When Only One Person Has Qualified As A Candidate For An Office, Such Person's Name Shall Be Placed On The General Election Ball...",Fail,https://legiscan.com/MS/bill/HB1002/2019,2019-02-05,Died In Committee
CT,SB01049,"To (1) require the Secretary of the State to develop a system through which election-related forms can be signed electronically, (2) require the Secretary to develop an online system for the registration of circulators of absentee ballots, (3) requir...",Intro,https://legiscan.com/CT/bill/SB01049/2019,2019-04-12,Referred to Office of Legislative Research and Office of Fiscal Analysis 04/17/19 5:00 PM
AZ,SB1139,Redistricting; legislative district one,Engross,https://legiscan.com/AZ/bill/SB1139/2019,2019-03-21,House Committee of the Whole action: Do Pass
MS,HB1007,"An Act To Authorize Any Person Who Is Qualified To Register To Vote In The State Of Mississippi To Register To Vote When That Person Applies For The Issuance, Renewal Or Change Of Address Of A Motor Vehicle Driver's License Or Official Identification...",Fail,https://legiscan.com/MS/bill/HB1007/2019,2019-02-05,Died In Committee
MS,HB423,"An Act To Authorize Any Person Who Is Qualified To Register To Vote In The State Of Mississippi To Register To Vote When That Person Applies For The Issuance, Renewal Or Change Of Address Of A Motor Vehicle Driver's License Or Official Identification...",Fail,https://legiscan.com/MS/bill/HB423/2019,2019-02-05,Died In Committee
MS,HB639,"An Act To Authorize Any Person Who Is Qualified To Register To Vote In The State Of Mississippi To Register To Vote When That Person Applies For The Issuance, Renewal Or Change Of Address Of A Motor Vehicle Driver's License Or Official Identification...",Fail,https://legiscan.com/MS/bill/HB639/2019,2019-02-05,Died In Committee
MS,HB1234,"An Act To Authorize Any Person Who Is Qualified To Register To Vote In The State Of Mississippi To Register To Vote When That Person Applies For The Issuance, Renewal Or Change Of Address Of A Motor Vehicle Driver's License Or Official Identification...",Fail,https://legiscan.com/MS/bill/HB1234/2019,2019-02-05,Died In Committee
NC,S214,Ensure Orderly 2019 Elections,Pass,https://legiscan.com/NC/bill/S214/2019,2019-03-14,Ch. SL 2019-4
ND,1001,"A BILL for an Act to provide an appropriation for defraying the expenses of the legislative branch of state government; to provide for applications, transfers, and cancellation of unexpended appropriations; to amend and reenact sections 54-03-20 and ...",Engross,https://legiscan.com/ND/bill/1001/2019,2019-04-17,Returned to House (12)
SD,HB1133,Repeal certain provisions regarding the Legislature.,Intro,https://legiscan.com/SD/bill/HB1133/2019,2019-02-20,"State Affairs Deferred to the 41st legislative day, Passed, YEAS 9, NAYS 2. H.J. 446"
HI,SB1135,"Provides the Land Use Commission with the power to amend, revise, or modify a decision and order granting a district boundary amendment, or fine a petitioner, when there has been a finding by the Land Use Commission that a petitioner or its successor...",Engross,https://legiscan.com/HI/bill/SB1135/2019,2019-03-07,"To House Water, Land, & Hawaiian Affairs Committee"
NM,HB175,Regional Water Utility Authority Act,Intro,https://legiscan.com/NM/bill/HB175/2019,2019-03-09,Action Postponed Indefinitely
WI,SB59,"State finances and appropriations, constituting the executive budget act of the 2019 legislature.",Intro,https://legiscan.com/WI/bill/SB59/2019,2019-04-15,Public hearing held
WI,AB56,"State finances and appropriations, constituting the executive budget act of the 2019 legislature.",Intro,https://legiscan.com/WI/bill/AB56/2019,2019-04-15,Public hearing held by joint committee on Finance
TX,HR914,In memory of former State Representative Tom Bass.,Pass,https://legiscan.com/TX/bill/HR914/2019,2019-04-11,Reported enrolled
MS,HB968,An Act To Authorize Any County Or Municipality To Hold An Election On The Question Of Permitting Nonpartisan Preferential Elections Or Retaining Partisan Primary Elections; To Provide The Method For Conducting The Nonpartisan Preferential Election If...,Fail,https://legiscan.com/MS/bill/HB968/2019,2019-02-05,Died In Committee
IL,HB2246,"Amends the Election Code. Provides that each election precinct shall contain 1,200 voters (currently, 500 voters in counties, 600 voters in a municipality with a board of election commissioners and fewer than 500,000 inhabitants, or 400 voters in a m...",Intro,https://legiscan.com/IL/bill/HB2246/2019,2019-03-29,To House Rules Committee
IL,SB1147,"Amends the Election Code. Provides that each election precinct shall contain 1,200 voters (currently, 500 voters in counties, 600 voters in a municipality with a board of election commissioners and fewer than 500,000 inhabitants, or 400 voters in a m...",Intro,https://legiscan.com/IL/bill/SB1147/2019,2019-03-28,To Senate Assignments Committee
KY,SR2,Adopt Rules of Procedure for the 2019 Regular Session of the Senate.,Pass,https://legiscan.com/KY/bill/SR2/2019,2019-01-08,adopted by voice vote
UT,SB0197,Law Enforcement Agency Amendments,Pass,https://legiscan.com/UT/bill/SB0197/2019,2019-03-25,Governor Signed in Lieutenant Governor's office for filing
MS,SB2258,"An Act To Amend Section 23-15-49, Mississippi Code Of 1972, To Authorize Qualified Electors To Submit Voter Registration Applications Through A Secure Internet Website Established By The Secretary Of State; To Establish The Procedure By Which The Cou...",Fail,https://legiscan.com/MS/bill/SB2258/2019,2019-02-05,Died In Committee
MO,SR19,Modifies Senate Rules 6 and 25,Pass,https://legiscan.com/MO/bill/SR19/2019,0000-00-00,"S adopted, as amended"
VA,SJR68,Constitutional amendment (first resolution); apportionment; criteria for electoral districts. Provides the criteria for electoral districts drawn by the General Assembly. The amendment directs that electoral districts are (i) to be composed of contig...,Intro,https://legiscan.com/VA/bill/SJR68/2019,2018-11-30,To Senate Privileges and Elections Committee
MO,SB181,WITHDRAWN,Intro,https://legiscan.com/MO/bill/SB181/2019,2019-01-02,Bill Withdrawn
VA,SJR258,Constitutional amendment (first resolution); political reform. Prohibits the establishment of electoral districts that intentionally or unduly favor or disfavor any political party and requires the General Assembly to regulate the role of money in el...,Intro,https://legiscan.com/VA/bill/SJR258/2019,2019-01-09,Passed by indefinitely in Privileges and Elections (12-Y 2-N)
WA,SB5269,Reorganizing school districts statewide.,Intro,https://legiscan.com/WA/bill/SB5269/2019,2019-01-16,To Senate Early Learning & K-12 Education Committee
NM,SJR9,"Public Education Commission, Ca",Intro,https://legiscan.com/NM/bill/SJR9/2019,2019-01-21,Action Postponed Indefinitely
NM,HM6,Risk For Undercount In 2020 Census,Intro,https://legiscan.com/NM/bill/HM6/2019,2019-02-05,Action Postponed Indefinitely
NM,SM11,New Mexico 2020 Census,Intro,https://legiscan.com/NM/bill/SM11/2019,2019-02-11,Action Postponed Indefinitely
CT,HB05611,To provide for the adjustment of population data so as to count incarcerated persons as residents of their last town of residence rather than as residents of the town in which the correctional facility is located.,Intro,https://legiscan.com/CT/bill/HB05611/2019,2019-02-11,To Joint Government Administration and Elections Committee
WA,HB2060,Concerning state preemption of nonuniform voting practices and procedures.,Intro,https://legiscan.com/WA/bill/HB2060/2019,2019-02-15,To House State Government & Tribal Relations Committee
GA,HR260,A RESOLUTION strongly opposing a request by the United States Department of Justice to add a citizenship question to Census 2020; and for other purposes.,Intro,https://legiscan.com/GA/bill/HR260/2019,2019-02-21,To House Judiciary Committee
IN,HCR0022,"A CONCURRENT RESOLUTION congratulating members of Delta Sigma Theta Sorority, Inc. on Delta Day at the Indiana State Capitol on this 26th day of February, 2019.",Pass,https://legiscan.com/IN/bill/HCR0022/2019,2019-02-27,Returned to the House
KY,SB2,Create a new section of KRS Chapter 26A to allow appointment of a special judge in certain civil actions.,Engross,https://legiscan.com/KY/bill/SB2/2019,2019-03-04,To House Judiciary Committee
FL,S0272,"Repealing provisions relating to the Florida Election Campaign Financing Act; deleting provisions governing the public funding of campaigns for candidates for statewide office who agree to certain expenditure limits, etc.",Intro,https://legiscan.com/FL/bill/S0272/2019,2019-03-05,To Senate Judiciary Committee
ID,S1115,APPROPRIATIONS -- LEGISLATIVE BRANCH -- Relates to the appropriation to the Legislative Branch for fiscal year 2019.,Pass,https://legiscan.com/ID/bill/S1115/2019,2019-03-07,Session Law Chapter 61 Effective: 03/07/2019
TN,HR0019,"Order of Elks, National Civil Liberties Annual Summit",Intro,https://legiscan.com/TN/bill/HR0019/2019,2019-03-07,Withdrawn.
TN,HJR0246,Lois Everett,Intro,https://legiscan.com/TN/bill/HJR0246/2019,2019-03-07,Withdrawn.
TN,HJR0243,Gregory L. Dodson,Intro,https://legiscan.com/TN/bill/HJR0243/2019,2019-03-07,Withdrawn.
TN,HJR0241,Calvin Drew,Intro,https://legiscan.com/TN/bill/HJR0241/2019,2019-03-07,Withdrawn.
TN,HJR0240,"Richard A. Dennis, Sr.",Intro,https://legiscan.com/TN/bill/HJR0240/2019,2019-03-07,Withdrawn.
TN,HJR0247,Damein Kirkwood,Intro,https://legiscan.com/TN/bill/HJR0247/2019,2019-03-07,Withdrawn.
TN,HJR0242,Yvonne Kent,Intro,https://legiscan.com/TN/bill/HJR0242/2019,2019-03-07,Withdrawn.
TN,HJR0251,"Order of Elks, National Civil Liberties Annual Summit",Intro,https://legiscan.com/TN/bill/HJR0251/2019,2019-03-07,Withdrawn.
TN,HJR0244,E. Yvonne Joyce,Intro,https://legiscan.com/TN/bill/HJR0244/2019,2019-03-07,Withdrawn.
TN,HJR0250,"Leonard J. Polk, Jr.",Intro,https://legiscan.com/TN/bill/HJR0250/2019,2019-03-07,Withdrawn.
TN,HJR0248,Carolyn Toney,Intro,https://legiscan.com/TN/bill/HJR0248/2019,2019-03-07,Withdrawn.
